{
  "$schema": "https://json-schema.org/draft/2020-12/schema",
  "$id": "https://harness-hq.local/contracts/task-pack.schema.json",
  "title": "TaskPack",
  "type": "object",
  "required": [
    "task_id",
    "goal",
    "scope",
    "constraints",
    "must_read",
    "acceptance_criteria",
    "verification_commands",
    "docs_required",
    "approval_required"
  ],
  "properties": {
    "task_id": {
      "type": "string",
      "pattern": "^[A-Z0-9-]+$"
    },
    "goal": {
      "type": "string"
    },
    "scope": {
      "type": "array",
      "items": {
        "type": "string"
      }
    },
    "constraints": {
      "type": "array",
      "items": {
        "type": "string"
      }
    },
    "must_read": {
      "type": "array",
      "items": {
        "type": "string"
      },
      "allOf": [
        {
          "contains": {
            "const": "docs/design/art-direction.kr.md"
          }
        },
        {
          "contains": {
            "const": "docs/design/ui-principles.kr.md"
          }
        },
        {
          "contains": {
            "const": "docs/design/browser-review.kr.md"
          }
        }
      ]
    },
    "acceptance_criteria": {
      "type": "array",
      "items": {
        "type": "string"
      }
    },
    "verification_commands": {
      "type": "array",
      "items": {
        "type": "string"
      }
    },
    "docs_required": {
      "type": "array",
      "items": {
        "type": "string"
      },
      "allOf": [
        {
          "contains": {
            "const": "docs/design/art-direction.kr.md"
          }
        },
        {
          "contains": {
            "const": "docs/design/ui-principles.kr.md"
          }
        },
        {
          "contains": {
            "const": "docs/design/browser-review.kr.md"
          }
        }
      ]
    },
    "approval_required": {
      "type": "boolean"
    }
  },
  "additionalProperties": true
}
