{
  "task_id": "BOOTSTRAP-001",
  "goal": "Focus Sprint 서비스의 첫 구현 루프를 시작한다.",
  "scope": [
    "제품 스펙과 구조 문서를 정렬한다.",
    "첫 구현 범위와 검증 방법을 고정한다."
  ],
  "constraints": [
    "문서 없는 구현은 완료로 보지 않는다.",
    "AGENTS.md는 짧게 유지한다."
  ],
  "must_read": [
    "AGENTS.md",
    "docs/product/product-spec.kr.md",
    "docs/architecture/why.kr.md"
  ],
  "acceptance_criteria": [
    "active exec plan이 최신 상태다.",
    "핵심 플로우 첫 구현 범위가 분명하다."
  ],
  "verification_commands": [
    "python3 scripts/harness.py pre-task",
    "python3 scripts/harness.py ci"
  ],
  "docs_required": [
    "docs/exec-plans/active/BOOTSTRAP-001.kr.md",
    "docs/build-journal.kr.md",
    "docs/architecture/why.kr.md",
    "docs/retrospectives/harness-feedback.kr.md"
  ],
  "approval_required": false
}

